{
  "schema": "game-experience/v1",
  "project_id": "fixture-threejs",
  "engine": {
    "name": "threejs",
    "version": "0.183.2"
  },
  "intent": {
    "path": "tests/game/fixtures/threejs-lifecycle/handoff/intent.md",
    "sha256": "cd52aec231f0e5fa444fdca7c72a86be9f3c854d3b8d6cd2569aadc493b0b109"
  },
  "targets": {
    "viewports": [
      [
        960,
        800
      ],
      [
        390,
        844
      ]
    ],
    "inputs": [
      "keyboard",
      "touch"
    ],
    "camera": "three-quarter perspective"
  },
  "required": {
    "states": [
      "ready",
      "playing",
      "paused",
      "won",
      "lost",
      "settings"
    ],
    "components": {
      "start": [
        "default",
        "pressed",
        "focus"
      ],
      "left": [
        "default",
        "pressed",
        "focus",
        "disabled"
      ],
      "right": [
        "default",
        "pressed",
        "focus",
        "disabled"
      ],
      "pause": [
        "default",
        "pressed",
        "focus",
        "disabled"
      ],
      "settings": [
        "default",
        "pressed",
        "focus"
      ],
      "options": [
        "default"
      ],
      "motion": [
        "default",
        "focus"
      ],
      "contrast": [
        "default",
        "focus"
      ],
      "close-settings": [
        "default",
        "pressed",
        "focus"
      ]
    },
    "assets": [
      "character/courier"
    ],
    "concepts": [
      "character",
      "environment",
      "ui"
    ]
  },
  "journeys": [
    {
      "id": "core-loop",
      "states": [
        "ready",
        "playing",
        "paused",
        "won",
        "lost",
        "settings"
      ],
      "transitions": [
        [
          "ready",
          "playing"
        ],
        [
          "playing",
          "paused"
        ],
        [
          "paused",
          "playing"
        ],
        [
          "playing",
          "won"
        ],
        [
          "playing",
          "lost"
        ],
        [
          "won",
          "playing"
        ],
        [
          "lost",
          "playing"
        ],
        [
          "playing",
          "settings"
        ],
        [
          "settings",
          "playing"
        ]
      ]
    }
  ],
  "screens": [
    {
      "id": "ready",
      "states": [
        "ready"
      ],
      "wireframe": {
        "path": "tests/game/fixtures/threejs-lifecycle/handoff/wireframes.svg",
        "sha256": "eb8cb4d2e692a291ae0efc9762fc099aa1baf28b23f39f750d43adddb8c9b92b"
      },
      "components": [
        "start",
        "left",
        "right",
        "pause",
        "settings"
      ]
    },
    {
      "id": "playing",
      "states": [
        "playing"
      ],
      "wireframe": {
        "path": "tests/game/fixtures/threejs-lifecycle/handoff/wireframes.svg",
        "sha256": "eb8cb4d2e692a291ae0efc9762fc099aa1baf28b23f39f750d43adddb8c9b92b"
      },
      "components": [
        "start",
        "left",
        "right",
        "pause",
        "settings"
      ]
    },
    {
      "id": "paused",
      "states": [
        "paused"
      ],
      "wireframe": {
        "path": "tests/game/fixtures/threejs-lifecycle/handoff/wireframes.svg",
        "sha256": "eb8cb4d2e692a291ae0efc9762fc099aa1baf28b23f39f750d43adddb8c9b92b"
      },
      "components": [
        "start",
        "left",
        "right",
        "pause",
        "settings"
      ]
    },
    {
      "id": "won",
      "states": [
        "won"
      ],
      "wireframe": {
        "path": "tests/game/fixtures/threejs-lifecycle/handoff/wireframes.svg",
        "sha256": "eb8cb4d2e692a291ae0efc9762fc099aa1baf28b23f39f750d43adddb8c9b92b"
      },
      "components": [
        "start",
        "left",
        "right",
        "pause",
        "settings"
      ]
    },
    {
      "id": "lost",
      "states": [
        "lost"
      ],
      "wireframe": {
        "path": "tests/game/fixtures/threejs-lifecycle/handoff/wireframes.svg",
        "sha256": "eb8cb4d2e692a291ae0efc9762fc099aa1baf28b23f39f750d43adddb8c9b92b"
      },
      "components": [
        "start",
        "left",
        "right",
        "pause",
        "settings"
      ]
    },
    {
      "id": "settings",
      "states": [
        "settings"
      ],
      "wireframe": {
        "path": "tests/game/fixtures/threejs-lifecycle/handoff/wireframes.svg",
        "sha256": "eb8cb4d2e692a291ae0efc9762fc099aa1baf28b23f39f750d43adddb8c9b92b"
      },
      "components": [
        "options",
        "motion",
        "contrast",
        "close-settings"
      ]
    }
  ],
  "concepts": {
    "character": {
      "applicable": true,
      "artifact": {
        "path": "tests/game/fixtures/threejs-lifecycle/handoff/concepts.svg",
        "sha256": "7ad9fc18b0dbbe7c8aae127224f721ad5ef13040f4cf23705e0f639d30441538"
      }
    },
    "environment": {
      "applicable": true,
      "artifact": {
        "path": "tests/game/fixtures/threejs-lifecycle/handoff/concepts.svg",
        "sha256": "7ad9fc18b0dbbe7c8aae127224f721ad5ef13040f4cf23705e0f639d30441538"
      }
    },
    "ui": {
      "applicable": true,
      "artifact": {
        "path": "tests/game/fixtures/threejs-lifecycle/handoff/concepts.svg",
        "sha256": "7ad9fc18b0dbbe7c8aae127224f721ad5ef13040f4cf23705e0f639d30441538"
      }
    }
  },
  "components": [
    {
      "id": "start",
      "states": [
        "default",
        "pressed",
        "focus"
      ],
      "spec": {
        "path": "tests/game/fixtures/threejs-lifecycle/handoff/wireframes.svg",
        "sha256": "eb8cb4d2e692a291ae0efc9762fc099aa1baf28b23f39f750d43adddb8c9b92b"
      },
      "runtime": {
        "path": "tests/game/fixtures/threejs-lifecycle/experience/app.ts",
        "sha256": "04965ad6f676d7ade829191c4364937480a4107a43ebded7c05e2af41f340def"
      },
      "preview": {
        "path": "templates/game/ui-kit/preview.html",
        "sha256": "d440635e27038b88a7016b343c05f91e6367564c6f78e0194c4fdfe686a8827f"
      }
    },
    {
      "id": "left",
      "states": [
        "default",
        "pressed",
        "focus",
        "disabled"
      ],
      "spec": {
        "path": "tests/game/fixtures/threejs-lifecycle/handoff/wireframes.svg",
        "sha256": "eb8cb4d2e692a291ae0efc9762fc099aa1baf28b23f39f750d43adddb8c9b92b"
      },
      "runtime": {
        "path": "tests/game/fixtures/threejs-lifecycle/experience/app.ts",
        "sha256": "04965ad6f676d7ade829191c4364937480a4107a43ebded7c05e2af41f340def"
      },
      "preview": {
        "path": "templates/game/ui-kit/preview.html",
        "sha256": "d440635e27038b88a7016b343c05f91e6367564c6f78e0194c4fdfe686a8827f"
      }
    },
    {
      "id": "right",
      "states": [
        "default",
        "pressed",
        "focus",
        "disabled"
      ],
      "spec": {
        "path": "tests/game/fixtures/threejs-lifecycle/handoff/wireframes.svg",
        "sha256": "eb8cb4d2e692a291ae0efc9762fc099aa1baf28b23f39f750d43adddb8c9b92b"
      },
      "runtime": {
        "path": "tests/game/fixtures/threejs-lifecycle/experience/app.ts",
        "sha256": "04965ad6f676d7ade829191c4364937480a4107a43ebded7c05e2af41f340def"
      },
      "preview": {
        "path": "templates/game/ui-kit/preview.html",
        "sha256": "d440635e27038b88a7016b343c05f91e6367564c6f78e0194c4fdfe686a8827f"
      }
    },
    {
      "id": "pause",
      "states": [
        "default",
        "pressed",
        "focus",
        "disabled"
      ],
      "spec": {
        "path": "tests/game/fixtures/threejs-lifecycle/handoff/wireframes.svg",
        "sha256": "eb8cb4d2e692a291ae0efc9762fc099aa1baf28b23f39f750d43adddb8c9b92b"
      },
      "runtime": {
        "path": "tests/game/fixtures/threejs-lifecycle/experience/app.ts",
        "sha256": "04965ad6f676d7ade829191c4364937480a4107a43ebded7c05e2af41f340def"
      },
      "preview": {
        "path": "templates/game/ui-kit/preview.html",
        "sha256": "d440635e27038b88a7016b343c05f91e6367564c6f78e0194c4fdfe686a8827f"
      }
    },
    {
      "id": "settings",
      "states": [
        "default",
        "pressed",
        "focus"
      ],
      "spec": {
        "path": "tests/game/fixtures/threejs-lifecycle/handoff/wireframes.svg",
        "sha256": "eb8cb4d2e692a291ae0efc9762fc099aa1baf28b23f39f750d43adddb8c9b92b"
      },
      "runtime": {
        "path": "templates/game/ui-kit/index.ts",
        "sha256": "2840942e775d332a9ef545975e854974901bf7eaf104075f201e8f8a938c3b70"
      },
      "preview": {
        "path": "templates/game/ui-kit/preview.html",
        "sha256": "d440635e27038b88a7016b343c05f91e6367564c6f78e0194c4fdfe686a8827f"
      }
    },
    {
      "id": "options",
      "states": [
        "default"
      ],
      "spec": {
        "path": "tests/game/fixtures/threejs-lifecycle/handoff/wireframes.svg",
        "sha256": "eb8cb4d2e692a291ae0efc9762fc099aa1baf28b23f39f750d43adddb8c9b92b"
      },
      "runtime": {
        "path": "templates/game/ui-kit/index.ts",
        "sha256": "2840942e775d332a9ef545975e854974901bf7eaf104075f201e8f8a938c3b70"
      },
      "preview": {
        "path": "templates/game/ui-kit/preview.html",
        "sha256": "d440635e27038b88a7016b343c05f91e6367564c6f78e0194c4fdfe686a8827f"
      }
    },
    {
      "id": "motion",
      "states": [
        "default",
        "focus"
      ],
      "spec": {
        "path": "tests/game/fixtures/threejs-lifecycle/handoff/wireframes.svg",
        "sha256": "eb8cb4d2e692a291ae0efc9762fc099aa1baf28b23f39f750d43adddb8c9b92b"
      },
      "runtime": {
        "path": "templates/game/ui-kit/index.ts",
        "sha256": "2840942e775d332a9ef545975e854974901bf7eaf104075f201e8f8a938c3b70"
      },
      "preview": {
        "path": "templates/game/ui-kit/preview.html",
        "sha256": "d440635e27038b88a7016b343c05f91e6367564c6f78e0194c4fdfe686a8827f"
      }
    },
    {
      "id": "contrast",